{
  "version": "2.0-audited",
  "lastUpdated": "2026-05-10",
  "totalIngredients": 36,
  "ingredients": [
    {
      "name": "Sodium Lauryl Sulfate",
      "category": "Surfactant",
      "low": "b",
      "med": "b",
      "high": "b",
      "fine": "b",
      "oily": "b",
      "notes": "Anionic surfactant. Strong cleansing action; can strip moisture with frequent use.",
      "tags": [
        "anionic",
        "cleansing",
        "high-porosity-safe",
        "sulfate",
        "surfactant"
      ],
      "product_roles": {
        "shampoo": {
          "score": 88,
          "notes": "Primary lathering surfactant; effective but potentially drying."
        },
        "co_wash": {
          "score": 10,
          "notes": "Sodium Lauryl Sulfate: strong anionic; too stripping for co-wash format."
        },
        "rinse_out_conditioner": {
          "score": 5,
          "notes": "Sodium Lauryl Sulfate: strong anionic; not suitable for conditioning formats."
        },
        "deep_conditioner_mask": {
          "score": 3,
          "notes": "Sodium Lauryl Sulfate: strong anionic; counterproductive in treatment formats."
        },
        "leave_in_conditioner": {
          "score": 2,
          "notes": "Sodium Lauryl Sulfate: strong anionic; not suitable for leave-on formats."
        },
        "hair_oil_serum": {
          "score": 1,
          "notes": "Sodium Lauryl Sulfate: strong anionic; incompatible with oil-serum formats."
        },
        "styling_product": {
          "score": 8,
          "notes": "Sodium Lauryl Sulfate: strong anionic; rarely used in styling formats."
        }
      },
      "aliases": [
        "SLS",
        "Sodium dodecyl sulfate",
        "SDS",
        "Sodium laurilsulfate"
      ],
      "molecular_weight_da": 288,
      "ionic_charge": "anionic",
      "penetration_depth": "surface"
    },
    {
      "name": "Sodium Laureth Sulfate",
      "category": "Surfactant",
      "low": "b",
      "med": "b",
      "high": "b",
      "fine": "b",
      "oily": "b",
      "notes": "Ethoxylated anionic surfactant. Milder than SLS; widely used primary cleanser.",
      "tags": [
        "anionic",
        "cleansing",
        "ethoxylated",
        "sulfate",
        "surfactant"
      ],
      "product_roles": {
        "shampoo": {
          "score": 85,
          "notes": "Workhorse shampoo surfactant; good foam and mildness balance."
        },
        "co_wash": {
          "score": 12,
          "notes": "Sodium Laureth Sulfate: anionic surfactant; too cleansing for co-wash format."
        },
        "rinse_out_conditioner": {
          "score": 6,
          "notes": "Sodium Laureth Sulfate: anionic surfactant; not suitable for conditioning formats."
        },
        "deep_conditioner_mask": {
          "score": 4,
          "notes": "Sodium Laureth Sulfate: anionic surfactant; counterproductive in treatment formats."
        },
        "leave_in_conditioner": {
          "score": 3,
          "notes": "Sodium Laureth Sulfate: anionic surfactant; not suitable for leave-on formats."
        },
        "hair_oil_serum": {
          "score": 2,
          "notes": "Sodium Laureth Sulfate: anionic surfactant; incompatible with oil-serum formats."
        },
        "styling_product": {
          "score": 9,
          "notes": "Sodium Laureth Sulfate: anionic surfactant; rarely used in styling formats."
        }
      },
      "aliases": [
        "SLES",
        "Sodium lauryl ether sulfate",
        "Sodium polyoxyethylene lauryl sulfate"
      ],
      "molecular_weight_da": 420,
      "ionic_charge": "anionic",
      "penetration_depth": "surface"
    },
    {
      "name": "Cocamidopropyl Betaine",
      "category": "Surfactant",
      "low": "g",
      "med": "g",
      "high": "g",
      "fine": "g",
      "oily": "g",
      "notes": "Amphoteric surfactant derived from coconut oil. Mild co-surfactant; improves foam and reduces irritation.",
      "tags": [
        "amphoteric",
        "co-surfactant",
        "fine-hair-safe",
        "foam-booster",
        "mild",
        "surfactant"
      ],
      "product_roles": {
        "shampoo": {
          "score": 78,
          "notes": "Excellent mild co-surfactant; improves foam quality and reduces irritation."
        },
        "co_wash": {
          "score": 65,
          "notes": "Cocamidopropyl Betaine: amphoteric; gentle enough for co-wash cleansing."
        },
        "rinse_out_conditioner": {
          "score": 30,
          "notes": "Cocamidopropyl Betaine: amphoteric; limited conditioning benefit in rinse-out."
        },
        "deep_conditioner_mask": {
          "score": 20,
          "notes": "Cocamidopropyl Betaine: amphoteric; minimal benefit in treatment formats."
        },
        "leave_in_conditioner": {
          "score": 18,
          "notes": "Cocamidopropyl Betaine: amphoteric; not ideal for leave-on formats."
        },
        "hair_oil_serum": {
          "score": 5,
          "notes": "Cocamidopropyl Betaine: amphoteric; not compatible with oil-serum formats."
        },
        "styling_product": {
          "score": 22,
          "notes": "Cocamidopropyl Betaine: amphoteric; occasional use in styling for slip."
        }
      },
      "aliases": [
        "CAPB",
        "Cocamidopropyl betaine",
        "Cocoamidopropyl betaine",
        "1-Propanaminium, 3-amino-N-(carboxymethyl)-N,N-dimethyl-, N-coco acyl derivs., hydroxides, inner salts"
      ],
      "molecular_weight_da": 342,
      "ionic_charge": "amphoteric",
      "penetration_depth": "surface"
    },
    {
      "name": "Dimethicone",
      "category": "Silicone",
      "low": "b",
      "med": "b",
      "high": "b",
      "fine": "b",
      "oily": "b",
      "notes": "Non-water-soluble silicone. Provides slip, shine, and frizz control; builds up without clarifying shampoo.",
      "tags": [
        "buildup-risk",
        "frizz-control",
        "non-water-soluble",
        "silicone",
        "slip",
        "smoothing"
      ],
      "product_roles": {
        "shampoo": {
          "score": 15,
          "notes": "Dimethicone: non-soluble silicone; rarely used in shampoo formats."
        },
        "co_wash": {
          "score": 10,
          "notes": "Dimethicone: non-soluble silicone; builds up without sulfate cleansing."
        },
        "rinse_out_conditioner": {
          "score": 72,
          "notes": "Dimethicone: non-soluble silicone; excellent slip and detangling in rinse-out."
        },
        "deep_conditioner_mask": {
          "score": 60,
          "notes": "Dimethicone: non-soluble silicone; adds slip but may block penetration in masks."
        },
        "leave_in_conditioner": {
          "score": 55,
          "notes": "Dimethicone: non-soluble silicone; frizz control but buildup risk in leave-on."
        },
        "hair_oil_serum": {
          "score": 82,
          "notes": "Dimethicone: non-soluble silicone; ideal serum ingredient for shine and smoothing."
        },
        "styling_product": {
          "score": 68,
          "notes": "Dimethicone: non-soluble silicone; frizz control and shine in styling formats."
        }
      },
      "aliases": [
        "Polydimethylsiloxane",
        "PDMS",
        "Dimethyl silicone",
        "Dimethylpolysiloxane"
      ],
      "molecular_weight_da": 9000,
      "ionic_charge": "neutral",
      "penetration_depth": "surface"
    },
    {
      "name": "Cyclopentasiloxane",
      "category": "Silicone",
      "low": "g",
      "med": "g",
      "high": "g",
      "fine": "g",
      "oily": "b",
      "notes": "Volatile cyclic silicone. Evaporates after application; leaves no residue.",
      "tags": [
        "fine-hair-safe",
        "low-buildup",
        "silicone",
        "volatile",
        "weightless"
      ],
      "product_roles": {
        "shampoo": {
          "score": 10,
          "notes": "Cyclopentasiloxane: volatile silicone; not useful in rinse-off shampoo."
        },
        "co_wash": {
          "score": 12,
          "notes": "Cyclopentasiloxane: volatile silicone; evaporates before benefit in co-wash."
        },
        "rinse_out_conditioner": {
          "score": 45,
          "notes": "Cyclopentasiloxane: volatile silicone; provides slip during application."
        },
        "deep_conditioner_mask": {
          "score": 30,
          "notes": "Cyclopentasiloxane: volatile silicone; limited benefit in long-contact formats."
        },
        "leave_in_conditioner": {
          "score": 70,
          "notes": "Cyclopentasiloxane: volatile silicone; evaporates cleanly in leave-on formats."
        },
        "hair_oil_serum": {
          "score": 88,
          "notes": "Cyclopentasiloxane: volatile silicone; ideal carrier in serums; evaporates cleanly."
        },
        "styling_product": {
          "score": 65,
          "notes": "Cyclopentasiloxane: volatile silicone; lightweight feel in styling products."
        }
      },
      "aliases": [
        "D5",
        "Cyclomethicone D5",
        "Decamethylcyclopentasiloxane"
      ],
      "molecular_weight_da": 370,
      "ionic_charge": "neutral",
      "penetration_depth": "surface"
    },
    {
      "name": "Amodimethicone",
      "category": "Silicone",
      "low": "g",
      "med": "g",
      "high": "g",
      "fine": "b",
      "oily": "b",
      "notes": "Amino-functional silicone. Substantive to damaged hair; targeted deposition reduces buildup on healthy hair.",
      "tags": [
        "amino-functional",
        "buildup-risk",
        "damage-repair",
        "silicone",
        "substantive"
      ],
      "product_roles": {
        "shampoo": {
          "score": 20,
          "notes": "Amodimethicone: amino silicone; limited benefit in rinse-off shampoo."
        },
        "co_wash": {
          "score": 35,
          "notes": "Amodimethicone: amino silicone; some deposition possible in co-wash."
        },